{
  "entry_sha256": "707c392e9d1d666152df7e8ccfe0e324a578968dd4493b19f60c9eced27d39dc",
  "event_scan_through": "2026-08-18",
  "freshness_status": "fresh",
  "issuer_id": "ISSUER:NVIDIA_CORP",
  "kind": "qrgf_v4_registry_scope_entry",
  "last_proposal_sha256": "8c91d672e0afb4b57c179a6079b83886a8b0924b09ac0e273d5c353f2474445c",
  "passport_hash": "59d3aea4a18be691662531fd27a1f16c44e9bd295af5909a36f8460d47444957",
  "passport_path": "data/v4/passports/3b18ea64b2cfb8814949444c6705ac995cb5c39a1745970c01117d2315820900/59d3aea4a18be691662531fd27a1f16c44e9bd295af5909a36f8460d47444957.json",
  "producer_release_sha256": "272d992aaf5de87807575aa5c554e4f0a2088065ece98f326068f089c26915c4",
  "quality_as_of": "2026-08-18T13:32:00Z",
  "quality_coverage_pct": 92.86,
  "quality_eligible": true,
  "quality_policy_version": "4.0.0-structural-v1",
  "quality_score": 92.23,
  "quality_status": "pass",
  "research_scope_key": "ISSUER:NVIDIA_CORP|common_equity",
  "schema_version": "1.0.0",
  "security_overlay": "common_equity"
}
